{
  "schema_version": 1,
  "meta": {
    "generated_by": "初期作成（空）",
    "legacy_source": null,
    "legacy_commit": null,
    "as_of": "2026-09-26T20:30:00+09:00",
    "status": "draft",
    "note": "この系統の試合後レビュー（敗因分析・成功要因）。定時更新の □8 で追記する。記録のみで、判定ロジックは変更しない"
  },
  "system": "experience",
  "reviews": []
}
